HS Code,HS Description,NAICS Code,NAICS Description
2942,Organic compounds; n.e.c. in chapter 29,3254,Pharmaceutical and Medicine Manufacturing
3001,"Glands and other organs (extracts, secretions thereof) for organo-therapeutic uses, dried, powdered or not; heparin and its salts; other human or animal substances for therapeutic or prophylactic uses n.e.c.",3254,Pharmaceutical and Medicine Manufacturing
3002,"Human blood; animal blood for therapeutic, prophylactic or diagnostic uses; antisera, other blood fractions, immunological products, modified or obtained by biotechnological processes; vaccines, toxins, cultures of micro-organisms (excluding yeasts) etc",3254,Pharmaceutical and Medicine Manufacturing
3003,"Medicaments; (not goods of heading no. 3002, 3005 or 3006) of two or more constituents mixed together for therapeutic or prophylactic use not in measured doses or in forms or packings for retail sale",3254,Pharmaceutical and Medicine Manufacturing
3004,"Medicaments; (not goods of heading no. 3002, 3005 or 3006) consisting of mixed or unmixed products for therapeutic or prophylactic use, put up in measured doses (incl. those in the form of transdermal admin. systems) or packed for retail sale",3254,Pharmaceutical and Medicine Manufacturing
3005,"Wadding, gauze, bandages (dressings, adhesive plasters, poultices), impregnated or coated with pharmaceutical substances or in forms or packings for retail sale, for medical, surgical or veterinary use",3391,Medical Equipment and Supplies Manufacturing
3006,Pharmaceutical goods,3391,Medical Equipment and Supplies Manufacturing
3006,Pharmaceutical goods,3254,Pharmaceutical and Medicine Manufacturing
3006,Pharmaceutical goods,3256,"Soap, Cleaning Compound, and Toilet Preparation Manufacturing"
3006,Pharmaceutical goods,3251,Basic Chemical Manufacturing
3101,"Fertilizers; animal or vegetable, whether or not mixed together or chemically treated; fertilizers produced by the mixing or chemical treatment of animal or vegetable products",3253,"Pesticide, Fertilizer, and Other Agricultural Chemical Manufacturing"
3102,"Fertilizers; mineral or chemical, nitrogenous",3253,"Pesticide, Fertilizer, and Other Agricultural Chemical Manufacturing"
3103,"Fertilizers; mineral or chemical, phosphatic",3253,"Pesticide, Fertilizer, and Other Agricultural Chemical Manufacturing"
3104,"Fertilizers; mineral or chemical, potassic",3253,"Pesticide, Fertilizer, and Other Agricultural Chemical Manufacturing"
3105,"Fertilizers; mineral or chemical, containing 2 or 3 of the elements nitrogen, phosphorus, potassium; other fertilisers; goods of chapter 31 in tablets or packages of gross weight not exceeding 10kg",3253,"Pesticide, Fertilizer, and Other Agricultural Chemical Manufacturing"
3201,"Tanning extracts of vegetable origin; tannins and their salts, ethers, esters and other derivatives",3251,Basic Chemical Manufacturing
3202,"Tanning substances; synthetic organic or inorganic tanning substances; tanning preparations, whether or not containing natural tanning substances, enzymatic preparations for pre-tanning",3256,"Soap, Cleaning Compound, and Toilet Preparation Manufacturing"
3203,"Colouring matter of vegetable or animal origin (including dyeing extracts, not animal black); whether or not chemically defined; preparations based on colouring matter of vegetable or animal origin",3251,Basic Chemical Manufacturing
3204,Synthetic organic colouring matter and preparations based thereon; synthetic organic products used as fluorescent brightening agents or as luminophores; whether or not chemically defined,3251,Basic Chemical Manufacturing
3205,Colour lakes; preparations based on colour lakes as specified in note 3 to this chapter,3251,Basic Chemical Manufacturing
3206,"Colouring matter and preparations thereof n.e.c. in heading no. 3203, 3204, 3205; inorganic products, kind used as luminophores whether or not chemically defined",3251,Basic Chemical Manufacturing
3207,"Pigments, prepared; opacifiers, colours, vitrifiable enamels, glazes, engobes (slips), liquid lustres etc as used in the ceramic enamelling or glass industry; glass frit and powder, granules or flakes",3251,Basic Chemical Manufacturing
3207,"Pigments, prepared; opacifiers, colours, vitrifiable enamels, glazes, engobes (slips), liquid lustres etc as used in the ceramic enamelling or glass industry; glass frit and powder, granules or flakes",3255,"Paint, Coating, and Adhesive Manufacturing"
3207,"Pigments, prepared; opacifiers, colours, vitrifiable enamels, glazes, engobes (slips), liquid lustres etc as used in the ceramic enamelling or glass industry; glass frit and powder, granules or flakes",3259,Other Chemical Product and Preparation Manufacturing
3208,"Paints, varnishes; (enamels and lacquers) based on synthetic polymers or chemically modified natural polymers, dispersed or dissolved in a non-aqueous medium",3255,"Paint, Coating, and Adhesive Manufacturing"
3209,"Paints and varnishes (including enamels and lacquers) based on synthetic or chemically modified natural polymers, dispersed or dissolved in an aqueous medium",3255,"Paint, Coating, and Adhesive Manufacturing"
3210,"Paints and varnishes (including enamels, lacquers and distempers), excluding those of heading no. 3209, prepared water pigments of a kind used for finishing leather",3255,"Paint, Coating, and Adhesive Manufacturing"
3211,Driers; prepared,3255,"Paint, Coating, and Adhesive Manufacturing"
3212,"Pigments (metallic powders and flakes) dispersed in non-aqueous media in liquid or paste form, as used in manufacture of paints (including enamels); stamping foils, dyes etc in forms, packing for retail sale",3329,Other Fabricated Metal Product Manufacturing
3212,"Pigments (metallic powders and flakes) dispersed in non-aqueous media in liquid or paste form, as used in manufacture of paints (including enamels); stamping foils, dyes etc in forms, packing for retail sale",3251,Basic Chemical Manufacturing
3212,"Pigments (metallic powders and flakes) dispersed in non-aqueous media in liquid or paste form, as used in manufacture of paints (including enamels); stamping foils, dyes etc in forms, packing for retail sale",3255,"Paint, Coating, and Adhesive Manufacturing"
3213,"Colours; artists, students, or signboard painters, modifying tints, amusement colours and the like; in tablets, tubes, jars, bottles, pan or in similar forms or packings",3399,Other Miscellaneous Manufacturing
3214,"Glaziers' putty, grafting putty, resin cements, caulking compounds and other mastics; painters' fillings; non-refractory surfacing preparations for facades, indoor walls, floors, ceilings or the like",3255,"Paint, Coating, and Adhesive Manufacturing"
3215,"Ink; printing, writing or drawing ink and other inks; whether or not concentrated or solid",3259,Other Chemical Product and Preparation Manufacturing
3301,"Oils; essential (concretes, absolutes); concentrates thereof in fats, fixed oils, waxes or the like (obtained by enfleurage or maceration); aqueous distillates, solutions and terpenic by-products thereof; resinoids; extracted oleoresins",3259,Other Chemical Product and Preparation Manufacturing
3301,"Oils; essential (concretes, absolutes); concentrates thereof in fats, fixed oils, waxes or the like (obtained by enfleurage or maceration); aqueous distillates, solutions and terpenic by-products thereof; resinoids; extracted oleoresins",3252,"Resin, Synthetic Rubber, and Artificial Synthetic Fibers and Filaments Manufacturing"
3302,"Odoriferous substances and mixtures (including alcoholic solutions) with a basis of one or more of these substances, of a kind used as raw materials in industry; other preparations based on odoriferous substances, of a kind used for beverage manufacture",3251,Basic Chemical Manufacturing
3302,"Odoriferous substances and mixtures (including alcoholic solutions) with a basis of one or more of these substances, of a kind used as raw materials in industry; other preparations based on odoriferous substances, of a kind used for beverage manufacture",3256,"Soap, Cleaning Compound, and Toilet Preparation Manufacturing"
3303,Perfumes and toilet waters,3256,"Soap, Cleaning Compound, and Toilet Preparation Manufacturing"
3304,"Cosmetic and toilet preparations; beauty, make-up and skin care preparations (excluding medicaments, including sunscreen or sun tan preparations), manicure or pedicure preparations",3256,"Soap, Cleaning Compound, and Toilet Preparation Manufacturing"
3305,Hair preparations; for use on the hair,3256,"Soap, Cleaning Compound, and Toilet Preparation Manufacturing"
3306,"Oral or dental hygiene preparations; including fixative pastes and powders; yarn used to clean between the teeth (dental floss), in individual retail packages",3256,"Soap, Cleaning Compound, and Toilet Preparation Manufacturing"
3307,"Perfumery, cosmetic or toilet preparations; pre-shave, shaving, after-shave, bath preparations; personal deodorants and depilatories; room deodorisers, perfumed or not with disinfectant properties or not",3256,"Soap, Cleaning Compound, and Toilet Preparation Manufacturing"
3307,"Perfumery, cosmetic or toilet preparations; pre-shave, shaving, after-shave, bath preparations; personal deodorants and depilatories; room deodorisers, perfumed or not with disinfectant properties or not",3259,Other Chemical Product and Preparation Manufacturing
3401,"Soap; organic surface-active preparations used as soap, skin washing, in bars, cakes, moulded pieces, shapes, liquid or cream, containing soap or not; for retail, paper, wadding, felt and nonwovens, impregnated, coated or covered with soap or detergent",3256,"Soap, Cleaning Compound, and Toilet Preparation Manufacturing"
3402,"Organic surface-active agents (not soap); surface-active, washing (including auxiliary washing) and cleaning preparations, containing soap or not, excluding those of heading no. 3401",3256,"Soap, Cleaning Compound, and Toilet Preparation Manufacturing"
3403,Lubricating preparations and those used in oil or grease treatment of textile and similar materials; excluding preparations containing 70% or more (by weight) of petroleum or bituminous mineral oils,3256,"Soap, Cleaning Compound, and Toilet Preparation Manufacturing"
3404,"Waxes; artificial, prepared",3256,"Soap, Cleaning Compound, and Toilet Preparation Manufacturing"
3405,"Polishes, creams, scouring pastes, powders and similar; in any form, (including articles impregnated, coated or covered with such), for furniture, footwear, floors, coachwork, glass or metal",3256,"Soap, Cleaning Compound, and Toilet Preparation Manufacturing"
3406,"Candles, tapers and the like",3399,Other Miscellaneous Manufacturing
3407,"Modelling pastes, including those for children; dental wax, impression compounds, in sets or packings for retail sale or in plates and similar forms; dentistry preparations with plaster base",3399,Other Miscellaneous Manufacturing
3407,"Modelling pastes, including those for children; dental wax, impression compounds, in sets or packings for retail sale or in plates and similar forms; dentistry preparations with plaster base",3391,Medical Equipment and Supplies Manufacturing
3501,"Casein, caseinates and other casein derivatives; casein glues",3115,Dairy Product Manufacturing
3501,"Casein, caseinates and other casein derivatives; casein glues",3255,"Paint, Coating, and Adhesive Manufacturing"
3501,"Casein, caseinates and other casein derivatives; casein glues",3251,Basic Chemical Manufacturing
3502,"Albumins (including concentrates of two or more whey proteins, containing by weight more than 80% whey proteins, calculated on the dry matter), albuminates and other albumin derivatives",3119,Other Food Manufacturing
3502,"Albumins (including concentrates of two or more whey proteins, containing by weight more than 80% whey proteins, calculated on the dry matter), albuminates and other albumin derivatives",3115,Dairy Product Manufacturing
3502,"Albumins (including concentrates of two or more whey proteins, containing by weight more than 80% whey proteins, calculated on the dry matter), albuminates and other albumin derivatives",3251,Basic Chemical Manufacturing
3503,"Gelatin (including gelatin in rectangular sheets, whether or not surface-worked or coloured) and gelatin derivatives; isinglass; other glues of animal origin, excluding casein glues of heading no. 3501",3255,"Paint, Coating, and Adhesive Manufacturing"
3503,"Gelatin (including gelatin in rectangular sheets, whether or not surface-worked or coloured) and gelatin derivatives; isinglass; other glues of animal origin, excluding casein glues of heading no. 3501",3259,Other Chemical Product and Preparation Manufacturing
3504,"Peptones and their derivatives; other protein substances and their derivatives n.e.c. or included; hide powder, whether or not chromed",3112,Grain and Oilseed Milling
3504,"Peptones and their derivatives; other protein substances and their derivatives n.e.c. or included; hide powder, whether or not chromed",3259,Other Chemical Product and Preparation Manufacturing
3504,"Peptones and their derivatives; other protein substances and their derivatives n.e.c. or included; hide powder, whether or not chromed",3251,Basic Chemical Manufacturing
3505,Dextrins and other modified starches (e.g. pregelatinised or esterified starches); glues based on starches or on dextrins or other modified starches,3112,Grain and Oilseed Milling
3505,Dextrins and other modified starches (e.g. pregelatinised or esterified starches); glues based on starches or on dextrins or other modified starches,3255,"Paint, Coating, and Adhesive Manufacturing"
3506,"Prepared glues and other prepared adhesives, n.e.c. or included; products suitable for use as glues or adhesives, put up for retail sale as glues or adhesives, not exceeding 1kg net weight",3255,"Paint, Coating, and Adhesive Manufacturing"
3507,Enzymes; prepared enzymes not elsewhere specified or included,3251,Basic Chemical Manufacturing
3601,Explosives; propellent powders,3259,Other Chemical Product and Preparation Manufacturing
3602,"Prepared explosives, other than propellent powders",3259,Other Chemical Product and Preparation Manufacturing
3603,Safety fuses; detonating cords; percussion or detonating caps; igniters; electric detonators,3259,Other Chemical Product and Preparation Manufacturing
3604,"Fireworks, signalling flares, rain rockets, fog signals and other pyrotechnic articles",3259,Other Chemical Product and Preparation Manufacturing
3605,Matches; other than pyrotechnic articles of heading no. 3604,3259,Other Chemical Product and Preparation Manufacturing
3606,Ferro-cerium and other pyrophoric alloys in all forms; articles of combustible materials n.e.c. in chapter 36,3259,Other Chemical Product and Preparation Manufacturing
3701,"Photographic plates and film in the flat, sensitised, unexposed, of any material other than paper, paperboard or textiles; instant print film in the flat, sensitised, unexposed, whether or not in packs",3259,Other Chemical Product and Preparation Manufacturing
3702,"Photographic film in rolls, sensitised, unexposed, of any material other than paper, paperboard or textiles; instant print film in rolls, sensitised, unexposed",3259,Other Chemical Product and Preparation Manufacturing
3703,"Photographic paper, paperboard and textiles; sensitised, unexposed",3259,Other Chemical Product and Preparation Manufacturing
3704,"Photographic plates, film, paper, paperboard and textiles, exposed but not developed",9900,
3705,"Photographic plates and film; exposed and developed, other than cinematographic film",9900,
3706,"Cinematographic film; exposed and developed, whether or not incorporating sound track or consisting only of sound track",9900,
3707,"Chemical preparations for photographic uses (other than varnishes, glues, adhesives and similar preparations); unmixed products for photographic uses, put up in measured portions or for retail sale",3259,Other Chemical Product and Preparation Manufacturing
3801,"Artificial graphite; colloidal or semi-colloidal graphite; preparations based on graphite or other carbon in the form of pastes, blocks, plates or other semi-manufactures",3279,Other Nonmetallic Mineral Product Manufacturing
3801,"Artificial graphite; colloidal or semi-colloidal graphite; preparations based on graphite or other carbon in the form of pastes, blocks, plates or other semi-manufactures",3359,Other Electrical Equipment and Component Manufacturing
3802,"Activated carbon; activated natural mineral products; animal black, including spent animal black",3259,Other Chemical Product and Preparation Manufacturing
3802,"Activated carbon; activated natural mineral products; animal black, including spent animal black",3251,Basic Chemical Manufacturing
3802,"Activated carbon; activated natural mineral products; animal black, including spent animal black",3279,Other Nonmetallic Mineral Product Manufacturing
3803,"Tall oil, whether or not refined",3251,Basic Chemical Manufacturing
3804,"Residual lyes from the manufacture of wood pulp, whether or not concentrated, desugared or chemically treated, including lignin sulphonates, but excluding tall oil of heading no. 3803",3221,"Pulp, Paper, and Paperboard Mills"
3805,"Gum, wood or sulphate turpentine, other terpenic oils; crude dipentene; sulphite turpentine, other crude para-cymene; pine oil containing alpha-terpineol as the main constituent",3251,Basic Chemical Manufacturing
3806,Rosin and resin acids and derivatives thereof; rosin spirit and rosin oils; run gums,3251,Basic Chemical Manufacturing
3806,Rosin and resin acids and derivatives thereof; rosin spirit and rosin oils; run gums,3252,"Resin, Synthetic Rubber, and Artificial Synthetic Fibers and Filaments Manufacturing"
3807,"Wood tar; wood tar oils; wood creosote; wood naphtha; vegetable pitch; brewers' pitch and similar preparations based on rosin, resin acids or on vegetable pitch",3251,Basic Chemical Manufacturing
3808,"Insecticides, rodenticides, fungicides, herbicides, anti-sprouting products, plant growth regulators, disinfectants and the like, put up in forms or packings for retail sale or as preparations or articles",3253,"Pesticide, Fertilizer, and Other Agricultural Chemical Manufacturing"
3808,"Insecticides, rodenticides, fungicides, herbicides, anti-sprouting products, plant growth regulators, disinfectants and the like, put up in forms or packings for retail sale or as preparations or articles",3256,"Soap, Cleaning Compound, and Toilet Preparation Manufacturing"
3809,"Finishing agents, dye carriers to accelerate the dyeing, fixing of dyestuffs, other products and preparations, of a kind used in the textile, paper, leather or like industries, n.e.c. or included",3256,"Soap, Cleaning Compound, and Toilet Preparation Manufacturing"
3809,"Finishing agents, dye carriers to accelerate the dyeing, fixing of dyestuffs, other products and preparations, of a kind used in the textile, paper, leather or like industries, n.e.c. or included",3259,Other Chemical Product and Preparation Manufacturing
3810,"Metal-pickling preparations; fluxes etc for soldering, brazing; welding powders, pastes of metal and other materials; preparations used as cores or coatings for welding electrodes or rods",3259,Other Chemical Product and Preparation Manufacturing
3811,"Anti-knock preparations, oxidation and gum inhibitors, viscosity improvers, anti-corrosive preparations and the like, for mineral oils (including gasoline) or other liquids used for the same purposes",3259,Other Chemical Product and Preparation Manufacturing
3812,"Prepared rubber accelerators; compound plasticisers for rubber or plastics, n.e.c. or included; anti-oxidising preparations and other compound stabilisers for rubber or plastics",3259,Other Chemical Product and Preparation Manufacturing
3813,Preparations and charges for fire extinguishers; charged fire-extinguishing grenades,3259,Other Chemical Product and Preparation Manufacturing
3814,"Organic composite solvents and thinners, not elsewhere specified or included; prepared paint or varnish removers",3255,"Paint, Coating, and Adhesive Manufacturing"
3815,"Reaction initiators, reaction accelerators and catalytic preparations n.e.c. or included",3251,Basic Chemical Manufacturing
3816,"Refractory cements, mortars, concretes and similar compositions, including dolomite ramming mix, other than products of heading 38.01",3271,Clay Product and Refractory Manufacturing
3817,"Mixed alkylbenzenes and mixed alkylnaphthalenes, other than those of heading no. 2707 or 2902",3251,Basic Chemical Manufacturing
3818,"Chemical elements doped for use in electronics, in the form of discs, wafers or similar forms; chemical compounds doped for use in electronics",3344,Semiconductor and Other Electronic Component Manufacturing
3819,"Hydraulic brake fluids and other prepared liquids for hydraulic transmission, not containing or containing less than 70% by weight of petroleum oils or oils obtained from bituminous minerals",3241,Petroleum and Coal Products Manufacturing
3820,Anti-freezing preparations and prepared de-icing fluids,3259,Other Chemical Product and Preparation Manufacturing
3821,"Prepared culture media for the development or maintenance of micro-organisms (including viruses and the like) or of plant, human or animal cells",3254,Pharmaceutical and Medicine Manufacturing
3822,"Reagents; diagnostic or laboratory reagents on a backing, prepared diagnostic or laboratory reagents whether or not on a backing, whether or not put up in the form of kits, other than those of heading 30.06; certified reference materials",3254,Pharmaceutical and Medicine Manufacturing
3823,Industrial monocarboxylic fatty acids; acid oils from refining; industrial fatty alcohols,3251,Basic Chemical Manufacturing
3824,"Prepared binders for foundry moulds or cores; chemical products and preparations of the chemical or allied industries (including those consisting of mixtures of natural products), not elsewhere specified or included",3259,Other Chemical Product and Preparation Manufacturing
3824,"Prepared binders for foundry moulds or cores; chemical products and preparations of the chemical or allied industries (including those consisting of mixtures of natural products), not elsewhere specified or included",3279,Other Nonmetallic Mineral Product Manufacturing
3824,"Prepared binders for foundry moulds or cores; chemical products and preparations of the chemical or allied industries (including those consisting of mixtures of natural products), not elsewhere specified or included",3273,Cement and Concrete Product Manufacturing
3824,"Prepared binders for foundry moulds or cores; chemical products and preparations of the chemical or allied industries (including those consisting of mixtures of natural products), not elsewhere specified or included",3251,Basic Chemical Manufacturing
3824,"Prepared binders for foundry moulds or cores; chemical products and preparations of the chemical or allied industries (including those consisting of mixtures of natural products), not elsewhere specified or included",3254,Pharmaceutical and Medicine Manufacturing
3825,"Residual products of the chemical or allied industries, not elsewhere specified or included; municipal waste; sewage sludge; other residual products.",3251,Basic Chemical Manufacturing
3826,Biodiesel and mixtures thereof; not containing or containing less than 70% by weight of petroleum oils or oils obtained from bituminous minerals,3251,Basic Chemical Manufacturing
3827,"Mixtures containing halogenated derivatives of methane, ethane or propane, not elsewhere specified or included",3251,Basic Chemical Manufacturing
3901,"Polymers of ethylene, in primary forms",3252,"Resin, Synthetic Rubber, and Artificial Synthetic Fibers and Filaments Manufacturing"
3902,"Polymers of propylene or of other olefins, in primary forms",3252,"Resin, Synthetic Rubber, and Artificial Synthetic Fibers and Filaments Manufacturing"
3903,"Polymers of styrene, in primary forms",3252,"Resin, Synthetic Rubber, and Artificial Synthetic Fibers and Filaments Manufacturing"
3904,"Polymers of vinyl chloride or of other halogenated olefins, in primary forms",3252,"Resin, Synthetic Rubber, and Artificial Synthetic Fibers and Filaments Manufacturing"
3905,"Polymers of vinyl acetate or of other vinyl esters, in primary forms; other vinyl polymers in primary forms",3252,"Resin, Synthetic Rubber, and Artificial Synthetic Fibers and Filaments Manufacturing"
3906,Acrylic polymers in primary forms,3252,"Resin, Synthetic Rubber, and Artificial Synthetic Fibers and Filaments Manufacturing"
3907,"Polyacetals, other polyethers and epoxide resins, in primary forms; polycarbonates, alkyd resins, polyallyl esters and other polyesters, in primary forms",3252,"Resin, Synthetic Rubber, and Artificial Synthetic Fibers and Filaments Manufacturing"
3908,Polyamides in primary forms,3252,"Resin, Synthetic Rubber, and Artificial Synthetic Fibers and Filaments Manufacturing"
3909,"Amino-resins, phenolic resins and polyurethanes, in primary forms",3252,"Resin, Synthetic Rubber, and Artificial Synthetic Fibers and Filaments Manufacturing"
3910,Silicones in primary forms,3252,"Resin, Synthetic Rubber, and Artificial Synthetic Fibers and Filaments Manufacturing"
3911,"Petroleum resins, coumarone-indene resins, polyterpenes, polysulphides, polysulphones and similar products of chemical synthesis n.e.c. in chapter 39, in primary forms",3252,"Resin, Synthetic Rubber, and Artificial Synthetic Fibers and Filaments Manufacturing"
3912,"Cellulose and its chemical derivatives, n.e.c. or included, in primary forms",3251,Basic Chemical Manufacturing
3912,"Cellulose and its chemical derivatives, n.e.c. or included, in primary forms",3252,"Resin, Synthetic Rubber, and Artificial Synthetic Fibers and Filaments Manufacturing"
