HS Code,HS Description,NAICS Code,NAICS Description
6004,"Fabrics; knitted or crocheted fabrics of a width exceeding 30 cm, other than those of heading 60.01, containing by weight 5% or more of elastomeric yarn or rubber thread",3132,Fabric Mills
6005,"Fabrics; warp knit (including those made on galloon knitting machines), other than those of headings 60.01 to 60.04",3132,Fabric Mills
6006,"Fabrics; knitted or crocheted fabrics, other than those of headings 60.01 to 60.04",3132,Fabric Mills
6101,"Coats; men's or boys' overcoats, car-coats, capes, cloaks, anoraks, ski-jackets, wind-cheaters, wind-jackets and similar articles; knitted or crocheted, other than those of heading no. 6103",3152,Cut and Sew Apparel Manufacturing
6102,"Coats; women's or girls' overcoats, car-coats, capes, cloaks, anoraks, ski-jackets, wind-cheaters, wind-jackets and similar articles, knitted or crocheted, other than those of heading no. 6104",3152,Cut and Sew Apparel Manufacturing
6103,"Suits, ensembles, jackets, blazers, trousers, bib and brace overalls, breeches, shorts (not swimwear); men's or boys', knitted or crocheted",3152,Cut and Sew Apparel Manufacturing
6104,"Suits, ensembles, jackets, dresses, skirts, divided skirts, trousers, bib and brace overalls, breeches and shorts (not swimwear), women's or girls', knitted or crocheted",3152,Cut and Sew Apparel Manufacturing
6105,"Shirts; men's or boys', knitted or crocheted",3152,Cut and Sew Apparel Manufacturing
6106,"Blouses, shirts and shirt-blouses; women's or girls', knitted or crocheted",3152,Cut and Sew Apparel Manufacturing
6107,"Underpants, briefs, nightshirts, pyjamas, bathrobes, dressing gowns and similar articles; men's or boys', knitted or crocheted",3152,Cut and Sew Apparel Manufacturing
6108,"Slips, petticoats, briefs, panties, nightdresses, pyjamas, negligees, bathrobes, dressing gowns and similar articles; women's or girls', knitted or crocheted",3152,Cut and Sew Apparel Manufacturing
6109,"T-shirts, singlets and other vests; knitted or crocheted",3152,Cut and Sew Apparel Manufacturing
6110,"Jerseys, pullovers, cardigans, waistcoats and similar articles; knitted or crocheted",3152,Cut and Sew Apparel Manufacturing
6111,"Garments and clothing accessories, babies'; knitted or crocheted",3152,Cut and Sew Apparel Manufacturing
6111,"Garments and clothing accessories, babies'; knitted or crocheted",3151,Apparel Knitting Mills
6112,"Track suits, ski suits and swimwear; knitted or crocheted",3152,Cut and Sew Apparel Manufacturing
6113,"Garments made up of knitted or crocheted fabrics of heading no. 5903, 5906 and 5907",3159,Apparel Accessories and Other Apparel Manufacturing
6113,"Garments made up of knitted or crocheted fabrics of heading no. 5903, 5906 and 5907",3152,Cut and Sew Apparel Manufacturing
6114,"Garments; knitted or crocheted, n.e.c. in chapter 61",3152,Cut and Sew Apparel Manufacturing
6115,"Hosiery; panty hose, tights, stockings, socks and other hosiery, including graduated compression hosiery (for example, stockings for varicose veins) and footwear without applied soles, knitted or crocheted",3151,Apparel Knitting Mills
6115,"Hosiery; panty hose, tights, stockings, socks and other hosiery, including graduated compression hosiery (for example, stockings for varicose veins) and footwear without applied soles, knitted or crocheted",3391,Medical Equipment and Supplies Manufacturing
6116,"Gloves, mittens and mitts; knitted or crocheted",3159,Apparel Accessories and Other Apparel Manufacturing
6116,"Gloves, mittens and mitts; knitted or crocheted",3399,Other Miscellaneous Manufacturing
6116,"Gloves, mittens and mitts; knitted or crocheted",3152,Cut and Sew Apparel Manufacturing
6117,"Clothing accessories; made up, knitted or crocheted, knitted or crocheted parts of garments or of clothing accessories",3159,Apparel Accessories and Other Apparel Manufacturing
6117,"Clothing accessories; made up, knitted or crocheted, knitted or crocheted parts of garments or of clothing accessories",3151,Apparel Knitting Mills
6201,"Overcoats, car-coats, capes, cloaks, anoraks (including ski-jackets), wind-cheaters, wind-jackets and similar articles, men's or boys', other than those of heading no. 6203 (not knitted or crocheted)",3152,Cut and Sew Apparel Manufacturing
6202,"Coats; women's or girls' overcoats, carcoats, capes, cloaks, anoraks (including ski-jackets), wind-cheaters, wind-jackets and similar articles, other than those of heading no. 6204 (not knitted or crocheted)",3152,Cut and Sew Apparel Manufacturing
6203,"Suits, ensembles, jackets, blazers, trousers, bib and brace overalls, breeches and shorts (other than swimwear); men's or boys' (not knitted or crocheted)",3152,Cut and Sew Apparel Manufacturing
6204,"Suits, ensembles, jackets, dresses, skirts, divided skirts, trousers, bib and brace overalls, breeches and shorts (other than swimwear); women's or girls' (not knitted or crocheted)",3152,Cut and Sew Apparel Manufacturing
6205,Shirts; men's or boys' (not knitted or crocheted),3152,Cut and Sew Apparel Manufacturing
6206,"Blouses, shirts and shirt-blouses; women's or girls' (not knitted or crocheted)",3152,Cut and Sew Apparel Manufacturing
6207,"Singlets and other vests, underpants, briefs, night-shirts, pyjamas, bathrobes, dressing gowns and similar articles; men's or boys' (not knitted or crocheted)",3152,Cut and Sew Apparel Manufacturing
6208,"Singlets and other vests, slips, petticoats, briefs, panties, nightdresses, pyjamas, negligees, bathrobes, dressing gowns and similar articles; women's or girls' (not knitted or crocheted)",3152,Cut and Sew Apparel Manufacturing
6209,Garments and clothing accessories; babies' (not knitted or crocheted),3152,Cut and Sew Apparel Manufacturing
6209,Garments and clothing accessories; babies' (not knitted or crocheted),3149,Other Textile Product Mills
6210,"Garments made up of fabrics of heading no. 5602, 5603, 5903, 5906 or 5907 (not knitted or crocheted)",3159,Apparel Accessories and Other Apparel Manufacturing
6210,"Garments made up of fabrics of heading no. 5602, 5603, 5903, 5906 or 5907 (not knitted or crocheted)",3132,Fabric Mills
6210,"Garments made up of fabrics of heading no. 5602, 5603, 5903, 5906 or 5907 (not knitted or crocheted)",3222,Converted Paper Product Manufacturing
6210,"Garments made up of fabrics of heading no. 5602, 5603, 5903, 5906 or 5907 (not knitted or crocheted)",3152,Cut and Sew Apparel Manufacturing
6211,"Track suits, swimwear and other garments (not knitted or crocheted)",3152,Cut and Sew Apparel Manufacturing
6212,"Brassieres, girdles, corsets, braces, suspenders, garters and similar articles and parts thereof; whether or not knitted or crocheted",3152,Cut and Sew Apparel Manufacturing
6212,"Brassieres, girdles, corsets, braces, suspenders, garters and similar articles and parts thereof; whether or not knitted or crocheted",3159,Apparel Accessories and Other Apparel Manufacturing
6213,Handkerchiefs (not knitted or crocheted),3159,Apparel Accessories and Other Apparel Manufacturing
6214,"Shawls, scarves, mufflers, mantillas, veils and the like (not knitted or crocheted)",3159,Apparel Accessories and Other Apparel Manufacturing
6215,"Ties, bow ties and cravats (not knitted or crocheted)",3159,Apparel Accessories and Other Apparel Manufacturing
6216,"Gloves, mittens and mitts (not knitted or crocheted)",3399,Other Miscellaneous Manufacturing
6216,"Gloves, mittens and mitts (not knitted or crocheted)",3159,Apparel Accessories and Other Apparel Manufacturing
6216,"Gloves, mittens and mitts (not knitted or crocheted)",3152,Cut and Sew Apparel Manufacturing
6217,Clothing accessories n.e.c.; parts of garments or accessories other than those of heading no. 6212 (not knitted or crocheted),3159,Apparel Accessories and Other Apparel Manufacturing
6301,Blankets and travelling rugs,3352,Household Appliance Manufacturing
6301,Blankets and travelling rugs,3141,Textile Furnishings Mills
6302,"Bed linen, table linen, toilet linen and kitchen linen",3141,Textile Furnishings Mills
6303,Curtains (including drapes) and interior blinds; curtain or bed valances,3141,Textile Furnishings Mills
6303,Curtains (including drapes) and interior blinds; curtain or bed valances,3379,Other Furniture Related Product Manufacturing
6304,Furnishing articles; excluding those of heading no. 9404,3141,Textile Furnishings Mills
6304,Furnishing articles; excluding those of heading no. 9404,,
6305,"Sacks and bags, of a kind used for the packing of goods",3149,Other Textile Product Mills
6306,"Tarpaulins, awnings and sunblinds; tents (including temporary canopies and similar articles); sails for boats, sailboards or landcraft; camping goods",3149,Other Textile Product Mills
6306,"Tarpaulins, awnings and sunblinds; tents (including temporary canopies and similar articles); sails for boats, sailboards or landcraft; camping goods",3261,Plastics Product Manufacturing
6307,"Textiles; made up articles n.e.c. in chapter 63, including dress patterns",3141,Textile Furnishings Mills
6307,"Textiles; made up articles n.e.c. in chapter 63, including dress patterns",3149,Other Textile Product Mills
6307,"Textiles; made up articles n.e.c. in chapter 63, including dress patterns",3391,Medical Equipment and Supplies Manufacturing
6307,"Textiles; made up articles n.e.c. in chapter 63, including dress patterns",3132,Fabric Mills
6307,"Textiles; made up articles n.e.c. in chapter 63, including dress patterns",3159,Apparel Accessories and Other Apparel Manufacturing
6308,"Textiles; sets of woven fabric and yarn, with or without accessories, for making into rugs, tapestries, embroidered tablecloths, serviettes and similar textile articles, in packings for retail sale",3399,Other Miscellaneous Manufacturing
6309,Textiles; worn clothing and other worn articles,9200,
6309,Textiles; worn clothing and other worn articles,9300,
6310,"Rags; used or new, scrap twine, cordage, rope and cables and worn out articles of twine, cordage, rope or cables, of textile materials",9100,
6401,"Footwear; waterproof, with outer soles and uppers of rubber or plastics, (uppers not fixed to the sole nor assembled by stitch, rivet, nail, screw, plug or similar)",3162,Footwear Manufacturing
6402,Footwear; with outer soles and uppers of rubber or plastics (excluding waterproof footwear),3162,Footwear Manufacturing
6403,"Footwear; with outer soles of rubber, plastics, leather or composition leather and uppers of leather",3162,Footwear Manufacturing
6404,"Footwear; with outer soles of rubber, plastics, leather or composition leather and uppers of textile materials",3162,Footwear Manufacturing
6405,Footwear; other footwear n.e.c. in chapter 64,3162,Footwear Manufacturing
6405,Footwear; other footwear n.e.c. in chapter 64,3221,"Pulp, Paper, and Paperboard Mills"
6406,"Footwear; parts of footwear; removable in-soles, heel cushions and similar articles; gaiters, le.g.ings and similar articles, and parts thereof",3169,Other Leather and Allied Product Manufacturing
6406,"Footwear; parts of footwear; removable in-soles, heel cushions and similar articles; gaiters, le.g.ings and similar articles, and parts thereof",3149,Other Textile Product Mills
6406,"Footwear; parts of footwear; removable in-soles, heel cushions and similar articles; gaiters, le.g.ings and similar articles, and parts thereof",3262,Rubber Product Manufacturing
6406,"Footwear; parts of footwear; removable in-soles, heel cushions and similar articles; gaiters, le.g.ings and similar articles, and parts thereof",3219,Other Wood Product Manufacturing
6406,"Footwear; parts of footwear; removable in-soles, heel cushions and similar articles; gaiters, le.g.ings and similar articles, and parts thereof",3151,Apparel Knitting Mills
6406,"Footwear; parts of footwear; removable in-soles, heel cushions and similar articles; gaiters, le.g.ings and similar articles, and parts thereof",3159,Apparel Accessories and Other Apparel Manufacturing
6501,"Hat-forms, hat bodies and hoods of felt, neither blocked to shape nor with made brims; plateaux and manchons (including slit manchons) of felt",3159,Apparel Accessories and Other Apparel Manufacturing
6502,"Hat-shapes; plaited or made by assembling strips of any material, neither blocked to shape, nor with made brims, nor lined, nor trimmed",3159,Apparel Accessories and Other Apparel Manufacturing
6504,"Hats and other headgear; plaited or made by assembling strips of any material, whether or not lined or trimmed",3159,Apparel Accessories and Other Apparel Manufacturing
6505,"Hats and other headgear; knitted or crocheted, or made up from lace, felt or other textile fabric, in the piece (but not in strips), whether or not lined or trimmed; hair-nets of any material, whether or not lined or trimmed",3399,Other Miscellaneous Manufacturing
6505,"Hats and other headgear; knitted or crocheted, or made up from lace, felt or other textile fabric, in the piece (but not in strips), whether or not lined or trimmed; hair-nets of any material, whether or not lined or trimmed",3159,Apparel Accessories and Other Apparel Manufacturing
6505,"Hats and other headgear; knitted or crocheted, or made up from lace, felt or other textile fabric, in the piece (but not in strips), whether or not lined or trimmed; hair-nets of any material, whether or not lined or trimmed",3152,Cut and Sew Apparel Manufacturing
6505,"Hats and other headgear; knitted or crocheted, or made up from lace, felt or other textile fabric, in the piece (but not in strips), whether or not lined or trimmed; hair-nets of any material, whether or not lined or trimmed",3151,Apparel Knitting Mills
6506,"Headgear; n.e.c. in chapter 65, whether or not lined or trimmed",3391,Medical Equipment and Supplies Manufacturing
6506,"Headgear; n.e.c. in chapter 65, whether or not lined or trimmed",3399,Other Miscellaneous Manufacturing
6506,"Headgear; n.e.c. in chapter 65, whether or not lined or trimmed",3262,Rubber Product Manufacturing
6506,"Headgear; n.e.c. in chapter 65, whether or not lined or trimmed",3159,Apparel Accessories and Other Apparel Manufacturing
6506,"Headgear; n.e.c. in chapter 65, whether or not lined or trimmed",3152,Cut and Sew Apparel Manufacturing
6507,"Head-bands, linings, covers, hat foundations, hat frames, peaks and chinstraps, for headgear",3159,Apparel Accessories and Other Apparel Manufacturing
6601,"Umbrellas; sun umbrellas (including walking stick umbrellas, garden umbrellas and similar umbrellas)",3399,Other Miscellaneous Manufacturing
6602,"Walking-sticks, seat-sticks, whips, riding-crops and the like",3399,Other Miscellaneous Manufacturing
6602,"Walking-sticks, seat-sticks, whips, riding-crops and the like",3169,Other Leather and Allied Product Manufacturing
6603,"Trimmings, parts and accessories of articles of heading no. 6601 or 6602",3399,Other Miscellaneous Manufacturing
6603,"Trimmings, parts and accessories of articles of heading no. 6601 or 6602",3329,Other Fabricated Metal Product Manufacturing
6603,"Trimmings, parts and accessories of articles of heading no. 6601 or 6602",3261,Plastics Product Manufacturing
6701,"Skin and other parts of birds with their feather or down; feathers, parts of feather, down and articles thereof (other than goods of heading no. 0505 and worked quills and scapes)",3399,Other Miscellaneous Manufacturing
6702,"Flowers, foliage and fruit, artificial, and parts thereof; articles made of artificial flowers, foliage or fruit",3399,Other Miscellaneous Manufacturing
6703,"Human hair, dressed, thinned, bleached or otherwise worked; wool or other animal hair or other textile materials, prepared for use in making wigs or the like",3399,Other Miscellaneous Manufacturing
6704,"Wigs, false beards, eyebrows and eyelashes, switches and the like, of human or animal hair or of textile materials; articles of human hair, n.e.c. or included",3399,Other Miscellaneous Manufacturing
6801,"Stone; setts, curbstones and flagstones, of natural stone (except slate)",3279,Other Nonmetallic Mineral Product Manufacturing
6802,"Monumental or building stone, worked (except slate) and articles thereof (not of heading no. 6801) mosaic cubes etc., of natural stone including slate; artificially coloured granules of natural stone",3279,Other Nonmetallic Mineral Product Manufacturing
6802,"Monumental or building stone, worked (except slate) and articles thereof (not of heading no. 6801) mosaic cubes etc., of natural stone including slate; artificially coloured granules of natural stone",3271,Clay Product and Refractory Manufacturing
6803,"Slate, worked; and articles of slate or of agglomerated slate",3279,Other Nonmetallic Mineral Product Manufacturing
6804,"Millstones, grindstones, grinding wheels, etc without frameworks, for grinding, sharpening, polishing, etc and parts thereof, natural stone, agglomerated natural or artificial abrasives or of ceramics",3279,Other Nonmetallic Mineral Product Manufacturing
6805,"Abrasive powder or grain; natural or artificial, on a base of textile material, of paper, paperboard or of other material, whether or not cut to shape or sewn or otherwise made up",3279,Other Nonmetallic Mineral Product Manufacturing
6806,"Slag, rock wool and similar mineral wools; exfoliated vermiculite, expanded clays, foamed slag, mixtures and articles of heat, sound insulating or sound-absorbing mineral materials",3279,Other Nonmetallic Mineral Product Manufacturing
6807,Asphalt or similar material; articles (e.g. petroleum bitumen or coal tar pitch),3241,Petroleum and Coal Products Manufacturing
6808,"Panels, boards, tiles, blocks and the like; of vegetable fibre, of straw, shavings, chips, particles, sawdust or other waste, of wood, agglomerated with cement, plaster or other mineral binders",3273,Cement and Concrete Product Manufacturing
6809,Plaster or compositions based on plaster; articles thereof,3274,Lime and Gypsum Product Manufacturing
6809,Plaster or compositions based on plaster; articles thereof,3279,Other Nonmetallic Mineral Product Manufacturing
6810,"Cement, concrete or artificial stone; whether or not reinforced, articles thereof",3273,Cement and Concrete Product Manufacturing
6810,"Cement, concrete or artificial stone; whether or not reinforced, articles thereof",3271,Clay Product and Refractory Manufacturing
6810,"Cement, concrete or artificial stone; whether or not reinforced, articles thereof",3279,Other Nonmetallic Mineral Product Manufacturing
6811,"Asbestos-cement, of cellulose fibre-cement or the like",3279,Other Nonmetallic Mineral Product Manufacturing
6812,"Fabricated asbestos fibres; mixtures with a basis of asbestos or of asbestos and magnesium carbonate; articles of such mixtures or of asbestos (e.g. thread, woven fabric, clothing, footwear), whether or not reinforced, not goods of heading 6811 or 6813",3391,Medical Equipment and Supplies Manufacturing
6812,"Fabricated asbestos fibres; mixtures with a basis of asbestos or of asbestos and magnesium carbonate; articles of such mixtures or of asbestos (e.g. thread, woven fabric, clothing, footwear), whether or not reinforced, not goods of heading 6811 or 6813",3279,Other Nonmetallic Mineral Product Manufacturing
6812,"Fabricated asbestos fibres; mixtures with a basis of asbestos or of asbestos and magnesium carbonate; articles of such mixtures or of asbestos (e.g. thread, woven fabric, clothing, footwear), whether or not reinforced, not goods of heading 6811 or 6813",3399,Other Miscellaneous Manufacturing
6813,"Friction material and articles thereof (e.g. sheets, rolls, strips, segments, discs, washers, pads) not mounted; for brakes, clutches or the like, with a basis of asbestos, other mineral substances, or cellulose",3363,Motor Vehicle Parts Manufacturing
6813,"Friction material and articles thereof (e.g. sheets, rolls, strips, segments, discs, washers, pads) not mounted; for brakes, clutches or the like, with a basis of asbestos, other mineral substances, or cellulose",3364,Aerospace Product and Parts Manufacturing
6814,"Mica; worked, articles of, including agglomerated or reconstituted mica; whether or not on a support of paper, paperboard or other materials",3279,Other Nonmetallic Mineral Product Manufacturing
6815,"Stone or other mineral substances; articles thereof (including carbon fibres, articles of carbon fibres and articles of peat), not elsewhere specified or included",3279,Other Nonmetallic Mineral Product Manufacturing
6815,"Stone or other mineral substances; articles thereof (including carbon fibres, articles of carbon fibres and articles of peat), not elsewhere specified or included",3359,Other Electrical Equipment and Component Manufacturing
6815,"Stone or other mineral substances; articles thereof (including carbon fibres, articles of carbon fibres and articles of peat), not elsewhere specified or included",3271,Clay Product and Refractory Manufacturing
6901,"Bricks, blocks, tiles and other ceramic goods of siliceous fossil meals (e.g. kieselguhr, tripolite or diatomite) or of similar siliceous earths",3271,Clay Product and Refractory Manufacturing
6902,"Refractory bricks, blocks, tiles and similar refractory ceramic constructional goods; other than those of siliceous fossil meals or similar siliceous earths",3271,Clay Product and Refractory Manufacturing
6903,"Ceramic goods; (e.g. retorts, crucibles, muffles, nozzles, plugs, supports cupels, tubes, pipes, sheaths, rods and slide gates) excluding those of siliceous fossil meals or of similar siliceous earths",3271,Clay Product and Refractory Manufacturing
6904,"Ceramic building bricks, floor blocks, support or filler tiles and the like",3271,Clay Product and Refractory Manufacturing
6905,"Roofing tiles, chimney-pots, cowls, chimney liners, architectural ornaments and other ceramic constructional goods",3271,Clay Product and Refractory Manufacturing
6906,"Ceramic pipes, conduits, guttering and pipe fittings",3271,Clay Product and Refractory Manufacturing
6907,"Ceramic flags and paving, hearth or wall tiles; ceramic mosaic cubes and the like, whether or not on a backing; finishing ceramics",3271,Clay Product and Refractory Manufacturing
6909,"Ceramic ware for laboratory, chemical, other technical uses; ceramic troughs, tubs, similar receptacles used in agriculture; ceramic pots, jars and similar used in the conveyance or packing of goods",3271,Clay Product and Refractory Manufacturing
6910,"Ceramic sinks, wash basins, wash basin pedestals, baths, bidets, water closet pans, flushing cisterns, urinals and similar sanitary fixtures",3271,Clay Product and Refractory Manufacturing
6911,"Tableware, kitchenware, other household articles and toilet articles; of porcelain or china",3271,Clay Product and Refractory Manufacturing
6912,"Ceramic tableware, kitchenware, other household articles and toilet articles; other than of porcelain or china",3271,Clay Product and Refractory Manufacturing
6913,Statuettes and other ornamental ceramic articles,3271,Clay Product and Refractory Manufacturing
6914,Ceramic articles; n.e.c. in chapter 69,3271,Clay Product and Refractory Manufacturing
7001,"Glass; cullet and other waste and scrap of glass, excluding glass from cathode ray tubes or other activated glass of heading 85.49, glass in the mass",3272,Glass and Glass Product Manufacturing
7002,"Glass in balls (other than microspheres of heading no. 7018), rods or tubes, unworked",3272,Glass and Glass Product Manufacturing
7003,"Glass; cast glass and rolled glass in sheets or profiles, whether or not having an absorbent, reflecting or non-reflecting layer, but not otherwise worked",3272,Glass and Glass Product Manufacturing
7004,"Glass; drawn glass and blown glass, in sheets, whether or not having an absorbent, reflecting or non-reflecting layer, but not otherwise worked",3272,Glass and Glass Product Manufacturing
7005,"Glass; float glass and surface ground or polished glass, in sheets, whether or not having an absorbent, reflecting or non-reflecting layer, but not otherwise worked",3272,Glass and Glass Product Manufacturing
7006,"Glass of heading no. 7003, 7004 or 7005, bent, edge-worked, engraved, drilled, enamelled or otherwise worked, not framed or fitted with other materials",3272,Glass and Glass Product Manufacturing
7007,"Safety glass, consisting of toughened (tempered) or laminated glass",3272,Glass and Glass Product Manufacturing
7008,Glass; multiple-walled insulating units of glass,3272,Glass and Glass Product Manufacturing
7009,"Glass mirrors; whether or not framed, including rear-view mirrors",3272,Glass and Glass Product Manufacturing
7010,"Carboys, bottles, flasks, jars, pots, phials, ampoules, containers of glass of a kind used for the conveyance or packing of goods; preserving jars of glass; stoppers, lids and other closures of glass",3272,Glass and Glass Product Manufacturing
7011,"Glass envelopes (including bulbs and tubes), open and glass parts thereof, without fittings, for electric lamps and light sources, cathode-ray tubes or the like",3272,Glass and Glass Product Manufacturing
7013,"Glassware of a kind used for table, kitchen, toilet, office, indoor decoration or similar purposes (other than of heading no. 7010 or 7018)",3272,Glass and Glass Product Manufacturing
7014,"Signalling glassware and optical elements of glass (other than those of heading no. 7015), not optically worked",3272,Glass and Glass Product Manufacturing
7015,"Clock, watch and similar glasses, glasses for non-corrective or corrective spectacles, curved, bent, hallowed etc, not optically worked; hollow glass spheres and their segments for manufacture",3272,Glass and Glass Product Manufacturing
7016,"Glass; paving blocks, slabs, bricks, tiles etc, of pressed, moulded glass, whether or not wired, glass smallwares for decorative purposes leaded lights and the like; multicellular or foam glass",3272,Glass and Glass Product Manufacturing
