HS Code,HS Description,NAICS Code,NAICS Description
0101,"Horses, asses, mules and hinnies; live",1129,Other Animal Production
0102,Bovine animals; live,1121,Cattle Ranching and Farming
0102,Bovine animals; live,1129,Other Animal Production
0103,Swine; live,1122,Hog and Pig Farming
0104,Sheep and goats; live,1124,Sheep and Goat Farming
0105,"Poultry; live, fowls of the species Gallus domesticus, ducks, geese, turkeys and guinea fowls",1123,Poultry and Egg Production
0106,"Animals; live, n.e.c. in chapter 01",1129,Other Animal Production
0201,Meat of bovine animals; fresh or chilled,3116,Animal Slaughtering and Processing
0202,Meat of bovine animals; frozen,3116,Animal Slaughtering and Processing
0203,"Meat of swine; fresh, chilled or frozen",3116,Animal Slaughtering and Processing
0204,"Meat of sheep or goats; fresh, chilled or frozen",3116,Animal Slaughtering and Processing
0205,"Meat; of horses, asses, mules or hinnies, fresh, chilled or frozen",3116,Animal Slaughtering and Processing
0206,"Edible offal of bovine animals, swine, sheep, goats, horses, asses, mules or hinnies; fresh, chilled or frozen",3116,Animal Slaughtering and Processing
0207,"Meat and edible offal of poultry; of the poultry of heading no. 0105, (i.e. fowls of the species Gallus domesticus), fresh, chilled or frozen",3116,Animal Slaughtering and Processing
0208,"Meat and edible meat offal, n.e.c. in chapter 2; fresh, chilled or frozen",3116,Animal Slaughtering and Processing
0209,"Pig fat, free of lean meat, and poultry fat, not rendered or otherwise extracted, fresh, chilled, frozen, salted, in brine, dried or smoked",3116,Animal Slaughtering and Processing
0210,"Meat and edible meat offal; salted, in brine, dried or smoked; edible flours and meals of meat or meat offal",3116,Animal Slaughtering and Processing
0301,Fish; live,1125,Aquaculture
0302,"Fish; fresh or chilled, excluding fish fillets and other fish meat of heading 0304",1125,Aquaculture
0302,"Fish; fresh or chilled, excluding fish fillets and other fish meat of heading 0304",1141,Fishing
0303,"Fish; frozen, excluding fish fillets and other fish meat of heading 0304",1141,Fishing
0304,"Fish fillets and other fish meat (whether or not minced); fresh, chilled or frozen",1141,Fishing
0304,"Fish fillets and other fish meat (whether or not minced); fresh, chilled or frozen",1125,Aquaculture
0305,"Fish, dried, salted or in brine; smoked fish, whether or not cooked before, or during the smoking process",3117,Seafood Product Preparation and Packaging
0306,"Crustaceans; in shell or not, live, fresh, chilled, frozen, dried, salted or in brine; smoked, cooked or not before or during smoking; in shell, steamed or boiled, whether or not chilled, frozen, dried, salted or in brine",1141,Fishing
0307,"Molluscs; whether in shell or not, live, fresh, chilled, frozen, dried, salted or in brine; smoked molluscs, whether in shell or not, whether or not cooked before or during the smoking process",1141,Fishing
0307,"Molluscs; whether in shell or not, live, fresh, chilled, frozen, dried, salted or in brine; smoked molluscs, whether in shell or not, whether or not cooked before or during the smoking process",1125,Aquaculture
0308,"Aquatic invertebrates other than crustaceans and molluscs, live, fresh, chilled, frozen, dried, salted or in brine; smoked aquatic invertebrates other than crustaceans and molluscs, whether or not cooked before or during the smoking process",1141,Fishing
0309,"Flours, meals and pellets of fish, crustaceans, molluscs and other aquatic invertebrates, fit for human consumption",3117,Seafood Product Preparation and Packaging
0309,"Flours, meals and pellets of fish, crustaceans, molluscs and other aquatic invertebrates, fit for human consumption",1141,Fishing
0401,"Milk and cream; not concentrated, not containing added sugar or other sweetening matter",3115,Dairy Product Manufacturing
0402,Milk and cream; concentrated or containing added sugar or other sweetening matter,3115,Dairy Product Manufacturing
0403,"Yogurt; buttermilk, curdled milk and cream, kephir and other fermented or acidified milk and cream, whether or not concentrated or containing added sugar or other sweetening matter or flavoured or containing added fruit, nuts or cocoa.",3115,Dairy Product Manufacturing
0404,"Whey and products consisting of natural milk constituents; whether or not containing added sugar or other sweetening matter, not elsewhere specified or included",3115,Dairy Product Manufacturing
0405,Butter and other fats and oils derived from milk; dairy spreads,3115,Dairy Product Manufacturing
0405,Butter and other fats and oils derived from milk; dairy spreads,3112,Grain and Oilseed Milling
0406,Cheese and curd,3115,Dairy Product Manufacturing
0407,"Birds' eggs, in shell; fresh, preserved or cooked",1123,Poultry and Egg Production
0407,"Birds' eggs, in shell; fresh, preserved or cooked",3119,Other Food Manufacturing
0408,"Birds' eggs, not in shell; egg yolks, fresh, dried, cooked by steaming or boiling in water, moulded, frozen or otherwise preserved, whether or not containing added sugar or other sweetening matter",3119,Other Food Manufacturing
0409,Honey; natural,1129,Other Animal Production
0410,"Animal products; insects and other edible products of animal origin, not elsewhere specified or included",1141,Fishing
0501,"Human hair; unworked, whether or not washed or scoured; waste of human hair",9900,
0502,"Pigs', hogs' or boars' bristles and hair; and waste thereof",3116,Animal Slaughtering and Processing
0502,"Pigs', hogs' or boars' bristles and hair; and waste thereof",1129,Other Animal Production
0504,"Guts, bladders and stomachs of animals (other than fish); whole and pieces thereof, fresh, chilled, frozen, salted, in brine, dried or smoked",3116,Animal Slaughtering and Processing
0505,"Skins and other parts of birds with feathers, down; feathers, down and parts thereof; not further worked than cleaned, disinfected, treated for preservation; powder, waste and parts of feathers",9900,
0505,"Skins and other parts of birds with feathers, down; feathers, down and parts thereof; not further worked than cleaned, disinfected, treated for preservation; powder, waste and parts of feathers",3399,Other Miscellaneous Manufacturing
0505,"Skins and other parts of birds with feathers, down; feathers, down and parts thereof; not further worked than cleaned, disinfected, treated for preservation; powder, waste and parts of feathers",3116,Animal Slaughtering and Processing
0506,"Bones and horn-cores, unworked, defatted, simply prepared (but not cut to shape), treated with acid or degelatinised; powder and waste of these products",3116,Animal Slaughtering and Processing
0507,"Ivory, tortoise-shell, whalebone and whalebone hair, horns, antlers, hooves, nails, claws and beaks unworked or simply prepared, not cut to shape; waste and powder of these products",9900,
0508,"Coral and similar materials, unworked or simply prepared, shells of molluscs, crustaceans or echinoderms and cuttle-bone, not cut to shape powder and waste thereof",1141,Fishing
0510,"Ambergris, castoreum, civet and musk; cantharides; bile, dried or not glands, other animal products used in preparation of pharmaceutical products, fresh chilled, frozen or otherwise provisionally preserved",1141,Fishing
0510,"Ambergris, castoreum, civet and musk; cantharides; bile, dried or not glands, other animal products used in preparation of pharmaceutical products, fresh chilled, frozen or otherwise provisionally preserved",3116,Animal Slaughtering and Processing
0511,"Animal products not elsewhere specified or included; dead animals of chapter 1 or 3, unfit for human consumption",1121,Cattle Ranching and Farming
0511,"Animal products not elsewhere specified or included; dead animals of chapter 1 or 3, unfit for human consumption",3116,Animal Slaughtering and Processing
0511,"Animal products not elsewhere specified or included; dead animals of chapter 1 or 3, unfit for human consumption",9900,
0511,"Animal products not elsewhere specified or included; dead animals of chapter 1 or 3, unfit for human consumption",1141,Fishing
0601,"Bulbs, tubers, tuberous roots, corms, crowns and rhizomes; dormant, in growth or in flower; chicory plants and roots other than roots of heading no. 1212",1114,"Greenhouse, Nursery, and Floriculture Production"
0602,"Plants, live; n.e.c. in heading no. 0601, (including their roots) cuttings and slips; mushroom spawn",1114,"Greenhouse, Nursery, and Floriculture Production"
0603,"Flowers; cut flowers and flower buds of a kind suitable for bouquets or for ornamental purposes, fresh, dried, dyed, bleached, impregnated or otherwise prepared",1114,"Greenhouse, Nursery, and Floriculture Production"
0603,"Flowers; cut flowers and flower buds of a kind suitable for bouquets or for ornamental purposes, fresh, dried, dyed, bleached, impregnated or otherwise prepared",3399,Other Miscellaneous Manufacturing
0604,"Foliage, branches and other parts of plants, without flowers or flower buds, and grasses, mosses and lichens; suitable for bouquets or for ornamental purposes, fresh, dried, dyed, bleached, impregnated etc.",1132,Forest Nurseries and Gathering of Forest Products
0604,"Foliage, branches and other parts of plants, without flowers or flower buds, and grasses, mosses and lichens; suitable for bouquets or for ornamental purposes, fresh, dried, dyed, bleached, impregnated etc.",1114,"Greenhouse, Nursery, and Floriculture Production"
0604,"Foliage, branches and other parts of plants, without flowers or flower buds, and grasses, mosses and lichens; suitable for bouquets or for ornamental purposes, fresh, dried, dyed, bleached, impregnated etc.",3399,Other Miscellaneous Manufacturing
0701,Potatoes; fresh or chilled,1112,Vegetable and Melon Farming
0702,Tomatoes; fresh or chilled,1112,Vegetable and Melon Farming
0703,"Onions, shallots, garlic, leeks and other alliaceous vegetables; fresh or chilled",1112,Vegetable and Melon Farming
0704,"Cabbages, cauliflowers, kohlrabi, kale and similar edible brassicas; fresh or chilled",1112,Vegetable and Melon Farming
0705,Lettuce (lactuca sativa) and chicory (cichorium spp.) fresh or chilled,1112,Vegetable and Melon Farming
0706,"Carrots, turnips, salad beetroot, salsify, celeriac, radishes and similar edible roots; fresh or chilled",1112,Vegetable and Melon Farming
0707,Cucumbers and gherkins; fresh or chilled,1112,Vegetable and Melon Farming
0708,"Leguminous vegetables; shelled or unshelled, fresh or chilled",1112,Vegetable and Melon Farming
0709,"Vegetables; n.e.c. in chapter 07, fresh or chilled",1112,Vegetable and Melon Farming
0709,"Vegetables; n.e.c. in chapter 07, fresh or chilled",1114,"Greenhouse, Nursery, and Floriculture Production"
0709,"Vegetables; n.e.c. in chapter 07, fresh or chilled",1113,Fruit and Tree Nut Farming
0710,Vegetables (uncooked or cooked by steaming or boiling in water); frozen,3114,Fruit and Vegetable Preserving and Specialty Food Manufacturing
0711,"Vegetables provisionally preserved, but unsuitable in that state for immediate consumption",1113,Fruit and Tree Nut Farming
0711,"Vegetables provisionally preserved, but unsuitable in that state for immediate consumption",3114,Fruit and Vegetable Preserving and Specialty Food Manufacturing
0712,"Vegetables, dried; whole, cut, sliced, broken or in powder, but not further prepared",3112,Grain and Oilseed Milling
0712,"Vegetables, dried; whole, cut, sliced, broken or in powder, but not further prepared",3119,Other Food Manufacturing
0712,"Vegetables, dried; whole, cut, sliced, broken or in powder, but not further prepared",3114,Fruit and Vegetable Preserving and Specialty Food Manufacturing
0712,"Vegetables, dried; whole, cut, sliced, broken or in powder, but not further prepared",1112,Vegetable and Melon Farming
0713,"Vegetables, leguminous; shelled, whether or not skinned or split, dried",1111,Oilseed and Grain Farming
0714,"Manioc, arrowroot, salep, Jerusalem artichokes, sweet potatoes and similar roots and tubers with high starch or inulin content; fresh, chilled, frozen or dried, whether or not sliced or in the form of pellets; sago pith",1111,Oilseed and Grain Farming
0714,"Manioc, arrowroot, salep, Jerusalem artichokes, sweet potatoes and similar roots and tubers with high starch or inulin content; fresh, chilled, frozen or dried, whether or not sliced or in the form of pellets; sago pith",1119,Other Crop Farming
0714,"Manioc, arrowroot, salep, Jerusalem artichokes, sweet potatoes and similar roots and tubers with high starch or inulin content; fresh, chilled, frozen or dried, whether or not sliced or in the form of pellets; sago pith",1112,Vegetable and Melon Farming
0714,"Manioc, arrowroot, salep, Jerusalem artichokes, sweet potatoes and similar roots and tubers with high starch or inulin content; fresh, chilled, frozen or dried, whether or not sliced or in the form of pellets; sago pith",3114,Fruit and Vegetable Preserving and Specialty Food Manufacturing
0801,"Nuts, edible; coconuts, Brazil nuts and cashew nuts, fresh or dried, whether or not shelled or peeled",3119,Other Food Manufacturing
0801,"Nuts, edible; coconuts, Brazil nuts and cashew nuts, fresh or dried, whether or not shelled or peeled",1113,Fruit and Tree Nut Farming
0802,"Nuts (excluding coconuts, Brazils and cashew nuts); fresh or dried, whether or not shelled or peeled",1113,Fruit and Tree Nut Farming
0803,"Bananas, including plantains; fresh or dried",1113,Fruit and Tree Nut Farming
0803,"Bananas, including plantains; fresh or dried",3114,Fruit and Vegetable Preserving and Specialty Food Manufacturing
0804,"Dates, figs, pineapples, avocados, guavas, mangoes and mangosteens; fresh or dried",1113,Fruit and Tree Nut Farming
0804,"Dates, figs, pineapples, avocados, guavas, mangoes and mangosteens; fresh or dried",3114,Fruit and Vegetable Preserving and Specialty Food Manufacturing
0805,Citrus fruit; fresh or dried,1113,Fruit and Tree Nut Farming
0806,Grapes; fresh or dried,1113,Fruit and Tree Nut Farming
0806,Grapes; fresh or dried,3114,Fruit and Vegetable Preserving and Specialty Food Manufacturing
0807,Melons (including watermelons) and papaws (papayas); fresh,1112,Vegetable and Melon Farming
0807,Melons (including watermelons) and papaws (papayas); fresh,1113,Fruit and Tree Nut Farming
0808,"Apples, pears and quinces; fresh",1113,Fruit and Tree Nut Farming
0809,"Apricots, cherries, peaches (including nectarines), plums and sloes, fresh",1113,Fruit and Tree Nut Farming
0810,"Fruit, fresh; n.e.c. in chapter 08",1113,Fruit and Tree Nut Farming
0811,"Fruit and nuts; uncooked or cooked by steaming or boiling in water, frozen, whether or not containing added sugar or other sweetening matter",3114,Fruit and Vegetable Preserving and Specialty Food Manufacturing
0812,"Fruit and nuts provisionally preserved, but unsuitable in that state for immediate consumption",3114,Fruit and Vegetable Preserving and Specialty Food Manufacturing
0813,"Fruit, dried, other than that of heading no. 0801 to 0806; mixtures of nuts or dried fruits of this chapter",3114,Fruit and Vegetable Preserving and Specialty Food Manufacturing
0813,"Fruit, dried, other than that of heading no. 0801 to 0806; mixtures of nuts or dried fruits of this chapter",1113,Fruit and Tree Nut Farming
0814,"Peel of citrus fruit or melons (including watermelons); fresh, frozen dried or provisionally preserved in brine, in sulphur water or in other preservative solutions",3114,Fruit and Vegetable Preserving and Specialty Food Manufacturing
0901,"Coffee, whether or not roasted or decaffeinated; husks and skins; coffee substitutes containing coffee in any proportion",1113,Fruit and Tree Nut Farming
0901,"Coffee, whether or not roasted or decaffeinated; husks and skins; coffee substitutes containing coffee in any proportion",3119,Other Food Manufacturing
0901,"Coffee, whether or not roasted or decaffeinated; husks and skins; coffee substitutes containing coffee in any proportion",9100,
0902,Tea,3119,Other Food Manufacturing
0903,Mate,3119,Other Food Manufacturing
0904,Pepper of the genus piper; dried or crushed or ground fruits of the genus capsicum or of the genus pimenta,3119,Other Food Manufacturing
0905,Vanilla,1113,Fruit and Tree Nut Farming
0906,Cinnamon and cinnamon-tree flowers,1119,Other Crop Farming
0906,Cinnamon and cinnamon-tree flowers,3119,Other Food Manufacturing
0907,"Cloves (whole fruit, cloves and stems)",3119,Other Food Manufacturing
0908,"Nutmeg, mace and cardamoms",3119,Other Food Manufacturing
0909,"Seeds of anise, badian, fennel, coriander, cumin, caraway or juniper",3119,Other Food Manufacturing
0910,"Ginger, saffron, tumeric (curcuma), thyme, bay leaves, curry and other spices",3119,Other Food Manufacturing
0910,"Ginger, saffron, tumeric (curcuma), thyme, bay leaves, curry and other spices",1119,Other Crop Farming
1001,Wheat and meslin,1111,Oilseed and Grain Farming
1002,Rye,1111,Oilseed and Grain Farming
1003,Barley,1111,Oilseed and Grain Farming
1004,Oats,1111,Oilseed and Grain Farming
1005,Maize (corn),1111,Oilseed and Grain Farming
1005,Maize (corn),3119,Other Food Manufacturing
1006,Rice,1111,Oilseed and Grain Farming
1006,Rice,3112,Grain and Oilseed Milling
1007,Grain sorghum,1111,Oilseed and Grain Farming
1008,"Buckwheat, millet and canary seeds; other cereals",1111,Oilseed and Grain Farming
1101,Wheat or meslin flour,3112,Grain and Oilseed Milling
1102,Cereal flours; other than of wheat or meslin,3112,Grain and Oilseed Milling
1103,Cereal groats; meal and pellets,3112,Grain and Oilseed Milling
1104,"Cereal grains otherwise worked (e.g. hulled, rolled, flaked, pearled, sliced or kibbled) except rice of heading no. 1006; germ of cereals whole, rolled, flaked or ground",3112,Grain and Oilseed Milling
1105,"Flour, meal, powder, flakes, granules and pellets of potatoes",3112,Grain and Oilseed Milling
1105,"Flour, meal, powder, flakes, granules and pellets of potatoes",3114,Fruit and Vegetable Preserving and Specialty Food Manufacturing
1106,"Flour, meal and powder; of the dried leguminous vegetables of heading no. 0713, of sago or of roots or tubers of heading no. 0714 or of the products of chapter 8",3112,Grain and Oilseed Milling
1106,"Flour, meal and powder; of the dried leguminous vegetables of heading no. 0713, of sago or of roots or tubers of heading no. 0714 or of the products of chapter 8",3114,Fruit and Vegetable Preserving and Specialty Food Manufacturing
1107,Malt; whether or not roasted,3112,Grain and Oilseed Milling
1108,Starches; inulin,3112,Grain and Oilseed Milling
1109,Wheat gluten; whether or not dried,3112,Grain and Oilseed Milling
1201,"Soya beans, whether or not broken",1111,Oilseed and Grain Farming
1202,"Ground-nuts; not roasted or otherwise cooked, whether or not shelled or broken",1119,Other Crop Farming
1203,Copra,1113,Fruit and Tree Nut Farming
1204,"Oil seeds; linseed, whether or not broken",1111,Oilseed and Grain Farming
1205,Rape or colza seeds; whether or not broken,1111,Oilseed and Grain Farming
1206,Sunflower seeds; whether or not broken,1111,Oilseed and Grain Farming
1207,"Oil seeds and oleaginous fruits, n.e.c. in chapter 12; whether or not broken",1111,Oilseed and Grain Farming
1207,"Oil seeds and oleaginous fruits, n.e.c. in chapter 12; whether or not broken",1113,Fruit and Tree Nut Farming
1207,"Oil seeds and oleaginous fruits, n.e.c. in chapter 12; whether or not broken",1119,Other Crop Farming
1207,"Oil seeds and oleaginous fruits, n.e.c. in chapter 12; whether or not broken",1112,Vegetable and Melon Farming
1208,Flours and meals of oil seeds or oleaginous fruits; other than those of mustard,3112,Grain and Oilseed Milling
1209,"Seeds, fruit and spores; of a kind used for sowing",1119,Other Crop Farming
1209,"Seeds, fruit and spores; of a kind used for sowing",1112,Vegetable and Melon Farming
1209,"Seeds, fruit and spores; of a kind used for sowing",1114,"Greenhouse, Nursery, and Floriculture Production"
1210,"Hop cones, fresh or dried, whether or not ground, powdered or in the form of pellets; lupulin",1119,Other Crop Farming
1211,"Plants and parts of plants (including seeds and fruits), of a kind used primarily in perfumery, in pharmacy or for insecticidal, fungicidal or similar purposes, fresh, chilled, frozen or dried, whether or not cut, crushed or powdered",1119,Other Crop Farming
1211,"Plants and parts of plants (including seeds and fruits), of a kind used primarily in perfumery, in pharmacy or for insecticidal, fungicidal or similar purposes, fresh, chilled, frozen or dried, whether or not cut, crushed or powdered",1132,Forest Nurseries and Gathering of Forest Products
1211,"Plants and parts of plants (including seeds and fruits), of a kind used primarily in perfumery, in pharmacy or for insecticidal, fungicidal or similar purposes, fresh, chilled, frozen or dried, whether or not cut, crushed or powdered",1112,Vegetable and Melon Farming
1211,"Plants and parts of plants (including seeds and fruits), of a kind used primarily in perfumery, in pharmacy or for insecticidal, fungicidal or similar purposes, fresh, chilled, frozen or dried, whether or not cut, crushed or powdered",3114,Fruit and Vegetable Preserving and Specialty Food Manufacturing
1211,"Plants and parts of plants (including seeds and fruits), of a kind used primarily in perfumery, in pharmacy or for insecticidal, fungicidal or similar purposes, fresh, chilled, frozen or dried, whether or not cut, crushed or powdered",3119,Other Food Manufacturing
1212,"Locust beans, seaweeds and other algae, sugar beet, sugar cane, fresh, chilled, frozen or dried, whether or not ground; fruit stones, kernels and other vegetable products (including unroasted chicory roots) used primarily for human consumption, n.e.c.",1141,Fishing
1212,"Locust beans, seaweeds and other algae, sugar beet, sugar cane, fresh, chilled, frozen or dried, whether or not ground; fruit stones, kernels and other vegetable products (including unroasted chicory roots) used primarily for human consumption, n.e.c.",1119,Other Crop Farming
1212,"Locust beans, seaweeds and other algae, sugar beet, sugar cane, fresh, chilled, frozen or dried, whether or not ground; fruit stones, kernels and other vegetable products (including unroasted chicory roots) used primarily for human consumption, n.e.c.",1113,Fruit and Tree Nut Farming
1213,"Cereal straw and husks, unprepared; whether or not chopped, ground, pressed or in the form of pellets",1119,Other Crop Farming
1214,"Swedes, mangolds, fodder roots, hay, lucerne (alfalfa), clover, sainfoin, forage kale, lupines, vetches and similar forage products, whether or not in the form of pellets",3111,Animal Food Manufacturing
1214,"Swedes, mangolds, fodder roots, hay, lucerne (alfalfa), clover, sainfoin, forage kale, lupines, vetches and similar forage products, whether or not in the form of pellets",1119,Other Crop Farming
1301,"Lac; natural gums, resins, gum-resins and oleoresins (for example, balsams)",1132,Forest Nurseries and Gathering of Forest Products
1302,"Vegetable saps and extracts; pectic substances, pectinates and pectates; agar-agar and other mucilages and thickeners, whether or not modified, derived from vegetable products",1132,Forest Nurseries and Gathering of Forest Products
1302,"Vegetable saps and extracts; pectic substances, pectinates and pectates; agar-agar and other mucilages and thickeners, whether or not modified, derived from vegetable products",3119,Other Food Manufacturing
1302,"Vegetable saps and extracts; pectic substances, pectinates and pectates; agar-agar and other mucilages and thickeners, whether or not modified, derived from vegetable products",3254,Pharmaceutical and Medicine Manufacturing
1401,"Vegetable materials of a kind used primarily for plaiting; (e.g. bamboos, rattans, reeds, rushes, osier, raffia, cleaned, bleached or dyed cereal straw and lime bark)",1132,Forest Nurseries and Gathering of Forest Products
1404,Vegetable products not elsewhere specified or included,3112,Grain and Oilseed Milling
1404,Vegetable products not elsewhere specified or included,1119,Other Crop Farming
1404,Vegetable products not elsewhere specified or included,1132,Forest Nurseries and Gathering of Forest Products
1404,Vegetable products not elsewhere specified or included,1111,Oilseed and Grain Farming
1501,"Pig fat (including lard) and poultry fat, other than that of heading 0209 or 1503",3116,Animal Slaughtering and Processing
1502,"Fats of bovine animals, sheep or goats, other than those of heading 1503",3116,Animal Slaughtering and Processing
1503,"Lard stearin, lard oil, oleostearin, oleo-oil and tallow oil; not emulsified or mixed or otherwise prepared",3116,Animal Slaughtering and Processing
1504,"Fats and oils and their fractions of fish or marine mammals; whether or not refined, but not chemically modified",1141,Fishing
1505,Wool grease and fatty substances derived therefrom (including lanolin),3133,Textile and Fabric Finishing and Fabric Coating Mills
1505,Wool grease and fatty substances derived therefrom (including lanolin),3131,"Fiber, Yarn, and Thread Mills"
1505,Wool grease and fatty substances derived therefrom (including lanolin),3251,Basic Chemical Manufacturing
1506,"Animal fats and oils and their fractions; whether or not refined, but not chemically modified, n.e.c. in chapter 15",3116,Animal Slaughtering and Processing
1507,"Soya-bean oil and its fractions; whether or not refined, but not chemically modified",3112,Grain and Oilseed Milling
1508,"Ground nut oil and its fractions; whether or not refined, but not chemically modified",3112,Grain and Oilseed Milling
1509,"Olive oil and its fractions; whether or not refined, but not chemically modified",3112,Grain and Oilseed Milling
